[
  {
    "schemaVersion": 1,
    "movementId": "move-guard",
    "sourceRevision": 1,
    "motionHash": "4563e497256337c4c9567cecd1853719e0dfdcef3483b3b7c355c2e9569cd637",
    "intervals": [
      {
        "foot": "left",
        "start": 0,
        "end": 0.5,
        "decision": "supported",
        "notes": "Foot/toe appears on the floor in sampled Front and Side start/middle/end poses; measured height, speed and drift meet bounds. Only this source interval is covered; no anchor or physical balance claim.",
        "measurements": {
          "maxHorizontalDriftMeters": 0,
          "pathMeters": 0,
          "maxSpeedMetersPerSecond": 0,
          "minHeightMeters": 0.02718650168428645,
          "maxHeightMeters": 0.02718650168428645,
          "sampleCount": 31
        }
      },
      {
        "foot": "right",
        "start": 0,
        "end": 0.5,
        "decision": "supported",
        "notes": "Foot/toe appears on the floor in sampled Front and Side start/middle/end poses; measured height, speed and drift meet bounds. Only this source interval is covered; no anchor or physical balance claim.",
        "measurements": {
          "maxHorizontalDriftMeters": 0,
          "pathMeters": 0,
          "maxSpeedMetersPerSecond": 0,
          "minHeightMeters": 0.025046142498863486,
          "maxHeightMeters": 0.025046142498863486,
          "sampleCount": 31
        }
      }
    ],
    "reviewedAt": "2026-10-05T09:11:34.660Z",
    "reviewer": "llm-visual",
    "measurement": {
      "algorithm": "rig-motion-quality-v1",
      "sampleRate": 60,
      "measuredAt": "2026-10-05T09:11:34.659Z",
      "thresholds": {
        "floorY": 0,
        "footHeightTolerance": 0.05,
        "footSpeedTolerance": 0.15,
        "minContactDuration": 0.1,
        "contactDriftTolerance": 0.03,
        "boneLengthRelativeTolerance": 0.02,
        "scaleRelativeTolerance": 0.02,
        "rootVelocityJumpTolerance": 0.5,
        "jointVelocityJumpTolerance": 1,
        "angularVelocityJumpTolerance": 360
      }
    },
    "views": [
      "Front",
      "Side"
    ],
    "notes": "LLM sampled visual review of revision/hash-pinned source frames plus 60 Hz measured foot intervals. Additional hand/knee/body support and missing props remain unverified. Uncovered time unknown; source-only review, not whole-action approval.",
    "artifacts": [
      "authoring/reviews/catalog/sheets/move-guard-contacts.png",
      "authoring/reviews/catalog/move-guard.json",
      "authoring/reviews/catalog/local-frames-0/frames.json",
      "authoring/reviews/catalog/local-frames-1/frames.json"
    ],
    "physicalValidation": "not-performed",
    "uncoveredIntervals": "unknown",
    "reviewRevision": 1
  },
  {
    "schemaVersion": 1,
    "movementId": "move-kick",
    "sourceRevision": 1,
    "motionHash": "4e1ba14791015fc1d821b628f34bddaa95c421205c48c59a8a2dbc0f418d5d2c",
    "intervals": [
      {
        "foot": "left",
        "start": 0,
        "end": 1.8333333730697634,
        "decision": "supported",
        "notes": "Foot/toe appears on the floor in sampled Front and Side start/middle/end poses; measured height, speed and drift meet bounds. Only this source interval is covered; no anchor or physical balance claim.",
        "measurements": {
          "maxHorizontalDriftMeters": 7.030818424402401e-8,
          "pathMeters": 4.463629253586729e-7,
          "maxSpeedMetersPerSecond": 7.919427584606116e-7,
          "minHeightMeters": 0.027186487952290922,
          "maxHeightMeters": 0.02718652716423671,
          "sampleCount": 112
        }
      }
    ],
    "reviewedAt": "2026-10-05T09:11:34.732Z",
    "reviewer": "llm-visual",
    "measurement": {
      "algorithm": "rig-motion-quality-v1",
      "sampleRate": 60,
      "measuredAt": "2026-10-05T09:11:34.732Z",
      "thresholds": {
        "floorY": 0,
        "footHeightTolerance": 0.05,
        "footSpeedTolerance": 0.15,
        "minContactDuration": 0.1,
        "contactDriftTolerance": 0.03,
        "boneLengthRelativeTolerance": 0.02,
        "scaleRelativeTolerance": 0.02,
        "rootVelocityJumpTolerance": 0.5,
        "jointVelocityJumpTolerance": 1,
        "angularVelocityJumpTolerance": 360
      }
    },
    "views": [
      "Front",
      "Side"
    ],
    "notes": "LLM sampled visual review of revision/hash-pinned source frames plus 60 Hz measured foot intervals. Additional hand/knee/body support and missing props remain unverified. Uncovered time unknown; source-only review, not whole-action approval.",
    "artifacts": [
      "authoring/reviews/catalog/sheets/move-kick-contacts.png",
      "authoring/reviews/catalog/move-kick.json",
      "authoring/reviews/catalog/local-frames-0/frames.json",
      "authoring/reviews/catalog/local-frames-1/frames.json"
    ],
    "physicalValidation": "not-performed",
    "uncoveredIntervals": "unknown",
    "reviewRevision": 1
  },
  {
    "schemaVersion": 1,
    "movementId": "move-punch",
    "sourceRevision": 2,
    "motionHash": "44e9e822a7a8c4e2562fdc2d457b0146a6c47b7e10795822dd8a61c9dccd05c7",
    "intervals": [
      {
        "foot": "left",
        "start": 0,
        "end": 1,
        "decision": "supported",
        "notes": "Foot/toe appears on the floor in sampled Front and Side start/middle/end poses; measured height, speed and drift meet bounds. Only this source interval is covered; no anchor or physical balance claim.",
        "measurements": {
          "maxHorizontalDriftMeters": 0.0012679888814295468,
          "pathMeters": 0.007675359548667825,
          "maxSpeedMetersPerSecond": 0.08506406890127136,
          "minHeightMeters": 0.01418041289343265,
          "maxHeightMeters": 0.01481593012998382,
          "sampleCount": 62
        }
      },
      {
        "foot": "right",
        "start": 0,
        "end": 0.15,
        "decision": "supported",
        "notes": "Foot/toe appears on the floor in sampled Front and Side start/middle/end poses; measured height, speed and drift meet bounds. Only this source interval is covered; no anchor or physical balance claim.",
        "measurements": {
          "maxHorizontalDriftMeters": 0.00011835074182804211,
          "pathMeters": 0.00011863189723087825,
          "maxSpeedMetersPerSecond": 0.007117913833852697,
          "minHeightMeters": 0.015362505410978958,
          "maxHeightMeters": 0.015370668066756937,
          "sampleCount": 10
        }
      },
      {
        "foot": "right",
        "start": 0.25,
        "end": 0.48333333333333334,
        "decision": "supported",
        "notes": "Foot/toe appears on the floor in sampled Front and Side start/middle/end poses; measured height, speed and drift meet bounds. Only this source interval is covered; no anchor or physical balance claim.",
        "measurements": {
          "maxHorizontalDriftMeters": 0.0011870208536353907,
          "pathMeters": 0.0013366791739005215,
          "maxSpeedMetersPerSecond": 0.06601074483780496,
          "minHeightMeters": 0.015344954368932823,
          "maxHeightMeters": 0.015373553643751814,
          "sampleCount": 15
        }
      },
      {
        "foot": "right",
        "start": 0.6833333333333333,
        "end": 1,
        "decision": "supported",
        "notes": "Foot/toe appears on the floor in sampled Front and Side start/middle/end poses; measured height, speed and drift meet bounds. Only this source interval is covered; no anchor or physical balance claim.",
        "measurements": {
          "maxHorizontalDriftMeters": 0.0010628791795567452,
          "pathMeters": 0.0038861296684299103,
          "maxSpeedMetersPerSecond": 0.07611672108888944,
          "minHeightMeters": 0.014588134104158393,
          "maxHeightMeters": 0.015373058978066928,
          "sampleCount": 20
        }
      }
    ],
    "reviewedAt": "2026-10-05T09:11:34.804Z",
    "reviewer": "llm-visual",
    "measurement": {
      "algorithm": "rig-motion-quality-v1",
      "sampleRate": 60,
      "measuredAt": "2026-10-05T09:11:34.804Z",
      "thresholds": {
        "floorY": 0,
        "footHeightTolerance": 0.05,
        "footSpeedTolerance": 0.15,
        "minContactDuration": 0.1,
        "contactDriftTolerance": 0.03,
        "boneLengthRelativeTolerance": 0.02,
        "scaleRelativeTolerance": 0.02,
        "rootVelocityJumpTolerance": 0.5,
        "jointVelocityJumpTolerance": 1,
        "angularVelocityJumpTolerance": 360
      }
    },
    "views": [
      "Front",
      "Side"
    ],
    "notes": "LLM sampled visual review of revision/hash-pinned source frames plus 60 Hz measured foot intervals. Additional hand/knee/body support and missing props remain unverified. Uncovered time unknown; source-only review, not whole-action approval.",
    "artifacts": [
      "authoring/reviews/catalog/sheets/move-punch-contacts.png",
      "authoring/reviews/catalog/move-punch.json",
      "authoring/reviews/catalog/local-frames-0/frames.json",
      "authoring/reviews/catalog/local-frames-1/frames.json"
    ],
    "physicalValidation": "not-performed",
    "uncoveredIntervals": "unknown",
    "reviewRevision": 1
  },
  {
    "schemaVersion": 1,
    "movementId": "move-step-forward",
    "sourceRevision": 1,
    "motionHash": "f45dcfed8d47dd6f07982b9295348e3e328deb07d0d5e2f8d41eab4296201835",
    "intervals": [
      {
        "foot": "right",
        "start": 0.05,
        "end": 0.5166666666666667,
        "decision": "supported",
        "notes": "Foot/toe appears on the floor in sampled Front and Side start/middle/end poses; measured height, speed and drift meet bounds. Only this source interval is covered; no anchor or physical balance claim.",
        "measurements": {
          "maxHorizontalDriftMeters": 0.0008376346509506444,
          "pathMeters": 0.005978786863869509,
          "maxSpeedMetersPerSecond": 0.04600525868964582,
          "minHeightMeters": 0.015600729157503476,
          "maxHeightMeters": 0.017588922334711876,
          "sampleCount": 29